{
  "$schema": "https://json-schema.org/draft/2020-12/schema",
  "$id": "https://spectrum-systems.org/contracts/qos_ai_queue_pressure_record.schema.json",
  "title": "Qos Ai Queue Pressure Record",
  "type": "object",
  "additionalProperties": false,
  "required": [
    "artifact_type",
    "artifact_version",
    "schema_version",
    "record_id",
    "run_id",
    "owner",
    "status",
    "evidence_refs",
    "payload"
  ],
  "properties": {
    "artifact_type": {
      "type": "string",
      "const": "qos_ai_queue_pressure_record"
    },
    "artifact_version": {
      "type": "string",
      "const": "1.0.0"
    },
    "schema_version": {
      "type": "string",
      "const": "1.0.0"
    },
    "record_id": {
      "type": "string",
      "pattern": "^[A-Z0-9._:-]{6,128}$"
    },
    "run_id": {
      "type": "string",
      "pattern": "^run-[A-Za-z0-9._-]+$"
    },
    "owner": {
      "type": "string",
      "minLength": 2
    },
    "status": {
      "type": "string",
      "enum": [
        "pass",
        "fail",
        "blocked",
        "continue",
        "halt",
        "escalate",
        "suspend",
        "observe"
      ]
    },
    "evidence_refs": {
      "type": "array",
      "minItems": 1,
      "items": {
        "type": "string",
        "minLength": 3
      }
    },
    "payload": {
      "type": "object"
    }
  }
}
