{
  "artifact_type": "qos_ai_queue_pressure_record",
  "artifact_version": "1.0.0",
  "schema_version": "1.0.0",
  "record_id": "REC-QOS_AI_QUEUE_PRESSURE_RECORD",
  "run_id": "run-aig-001",
  "owner": "QOS",
  "status": "pass",
  "evidence_refs": [
    "artifact:seed-001"
  ],
  "payload": {
    "step": "qos_ai_queue_pressure_record",
    "note": "AIG-001 governed AI integration artifact"
  }
}
